수집날짜,뉴스 보도 날짜,수집국가,제목,내용,링크,언론사
2025-12-19 17:34:43,"Thu, 18 Dec 2025 04:00:34 +0000",en-US,Tokyo’s Tsukiji sushi neighborhood asks tour groups to stay away for the rest of the month,"Inbound tourism boom and Japanese New Year’s traditions are too much for the world’s most famous sushi town to handle simultaneously, request says.

For those with an interest in Japanese cuisine, you can’t hear the name of Tokyo’s Tsukiji neighborhood without thinking about sushi, and it’s hard to think of sushi for very long without thinking about Tsukiji. Up until 2018, the Tsukiji fish market was the largest seafood wholesale market in the entire world, and in the late 1990s it slowly started building fame as a tourist destination, drawing visitors from around the globe as Japanese food became more and more popular internationally.

When the Tsukiji fish market relocated to the Toyosu neighborhood in 2018, there was a lot of talk about how this would affect tourism patterns. Seven years later, though, very little has changed. Toyosu is farther outside of the city center, and while its more modern facilities are definitely a plus for wholesale buyers and sellers in terms of auction spaces and distribution infrastructure, for tourists, the place is pretty pricey and decidedly lacking in the old-school charm that helped Tsukiji earn its international fame. What’s more, the part of the Tsukiji market that moved was the “inner market,” which primarily dealt in wholesale sales to restaurants and large-quantity sales to Japanese residential households. The “outer market,” the organic collection of restaurants, snack stands, and smaller-quantity seafood merchants, i.e. the places that tourists are going to be the most interested in, is still there, and as popular with tourists as ever…and maybe even, in some ways, too popular, at least in the eyes of the Tsukiji Food Town Development Council, which is asking tour guides and tour groups to refrain from visiting the neighborhood during the month of December.

A sign posted in the neighborhood by the council, shown at the point queued in the above video, says:

We have an important request for tour guides and operators. The Tsukiji Outer Market is a kitchen for customers who come from all over Japan in December to purchase delicious foods for the New Year’s holiday season. It serves as a place to support families. During this time, the streets become very crowded, and so it is unsafe to eat while walking, move in large groups, or conduct guided tours. As such, we have the following request. Please refrain from conducting guided tours (tours for sightseeing, eating strolls, group guidance). This is a rule so that ordinary people too may safely and enjoyably do their New Year’s shopping. If this is not abided by, we may be forced to contact the police. We ask for your understanding and cooperation in this matter.

There’s actually quite a bit to chew on here, so let’s start with the New Year’s part. Traditionally, New Year’s, or Oshogatsu, as it’s called in Japanese, is the biggest holiday of the year. The customary way to spend the season is to head back to your home town before the end of December, then spend the first three days of January relaxing and reconnecting with family and old friends, often while enjoying something luxurious to eat in each other’s homes. As such, Tsukiji sees a surge in shoppers in late December, since the market has long had a reputation for high quality at reasonable prices.

▼ It really is hard to think of a better way to start the new year than this.

It’s also worth bearing in mind that Tsukiji wasn’t always a tourist attraction, and so it wasn’t really designed with sightseeing capacity in mind. The outer market area is a group of shops and restaurants that organically clustered inside a handful of blocks near the former inner market. It doesn’t have wide sidewalks or pedestrian plazas, and lines for popular places often form on the same streets that trucks have to drive down to make deliveries. In the early days, this wasn’t a problem, but when you combine Tsukiji’s present-day sightseeing crowds with the New Year’s shopping crowds, there’s the potential for things to get dangerously packed.

▼ The point queued in this video shows the conditions at Tsukiji during late December of 2024.

However, the situation gets more complicated because of the blurred line between “shoppers” and “sightseers” in Tsukiji. Again, Tsukiji sightseeing is pretty much all about sushi (even a local shrine is sushi-related), and no tourist is going to put “Tokyo’s sushi neighborhood” on their itinerary if they’re not also keen to get something to eat while they’re there. There’s also the fact that the non-tourist shoppers aren’t all necessarily locals, either. Tsukiji’s reputation for quality means that it attracts Japan-resident shoppers even from outside the surrounding area, and while they may not be there as part of “traveling,” it’s not like Tsukiji’s outer market is some small enclave only meant to serve the immediately nearby community.

A key difference, though, is that non-tourist shoppers, whether locals or not, tend to show up in smaller, less obtrusive groups. They’re comparatively less likely to roll up with a dozen companions, hold up lines as they try to figure out what all of the unfamiliar-to-them items are, or unwittingly block pedestrians as they stop to snap selfies. Not that non-tourist shoppers never do those things, or that any of them, in isolated instances, are unforgivable faux pas. Guided tours, though, tend to intensify and concentrate such issues, and that’s what’s at the root of the request for them to stay away from Tsukiji this month.

Now, the counterpoint to all this is that a lot of Tsukiji’s present-day prosperity comes from the attention it’s received from foreign tourists. Tsukiji wasn’t really a major sightseeing destination until the late 1990s, when jetlagged overseas travelers in Tokyo found out that Tsukiji’s fish market was one of the few things open when they woke up long before museums, shopping centers, and amusement parks were ready to receive guests, and even before most restaurants were open (this was in the days before Japanese convenience stores really upped the quality of their food). Word gradually spread that Tsukiji was a unique, fun, and delicious place to visit which then resparked interest in the neighborhood among Japanese people too, who were curious to take another look at what was causing all the international buzz, even if they weren’t going to, for instance, buy an entire tuna while they were there.

▼ There is always room for at least this much sushi. Always.

With that background, it can be tempting to see the Tsukiji Food Town Development Council’s request as a case of biting the hand that feeds it (while Tsukiji itself has been feeding that hand delicious sushi). However, it’s important to keep in mind the focused nature of the request: it’s guided tours/tour groups that are being asked not to come in December. Individual/independent tourists aren’t being discouraged from visiting the neighborhood, and the organization’s official English-language website currently has a statement saying:

“Many shoppers will be coming to Tsukiji in December. To protect the traditional Japanese culture of New Year’s shopping, and for safety reasons, please refrain from sightseeing and group tours. Thank you for your cooperation.”

There’s a bit of vagueness in the phrasing of “refrain from sightseeing and group tours,” in that it could be taken to mean either “refrain from conducting both sightseeing tours and conducting group tours” or “refrain from the activity of sightseeing and also from conducting group tours,” Even if it’s the latter, though, that’s more a request to not come to Tsukiji just to gawk and shoot photos, but to also purchase something while you’re there. Masahiro Terade, a Tsukiji shop owner and vice-chairman of the Tsukiji Food Town Development Council, also offered a bit of clarification during an interview when he said:

“There really are a lot of people in December. From a safety standpoint, we are asking for self-restraint, but we are not at all saying [for everyone] not to come to Tsukiji.”

The warning on the sign posted by the council mentioning the possibility of getting the police involved is somewhat intimidating-sounding, though, but it may or may not be completely enforceable. The Tsukiji outer market isn’t a single, self-contained facility, and the shops and restaurants that make it up are connected by a network of public streets. As such, the council might not actually have the legal jurisdiction to prohibit tour groups from coming to the area. It’s not unusual for tour providers to operate in a sort of legal gray area, though, in terms of conducting a business activity in public spaces, so a scenario in which the council contacts the police about a tour group could actually be a case of simply enforcing an ordinance that tour operators are usually given a pass on.

All that said, with overtourism becoming an increasingly hot-button topic in Japan, if you are planning a visit to Tsukiji this month, the polite thing to do would be to stay aware of your surroundings, and to make sure you’re not blocking, bothering, or otherwise infringing upon other people’s ability to enjoy their time in the neighborhood too. Really, though, that’s the proper thing to do regardless of what month you visit in.

Source: Teleasa News via Yahoo! Japan News, TBS News Dig, YouTube/ANNnewsCH

Top image: Wikipedia/Epicsunwarrior

Insert images: Pakutaso (1, 2)

● Want to hear about SoraNews24’s latest articles as soon as they’re published? Follow us on Facebook and Twitter!",https://soranews24.com/2025/12/18/tokyos-tsukiji-sushi-neighborhood-asks-tour-groups-to-stay-away-for-the-rest-of-the-month/,SoraNews
2025-12-19 17:34:44,"Thu, 18 Dec 2025 02:00:14 +0000",en-US,"Tokyo zoo imposes one-minute time limit for viewing pandas, line still four hours long","Ueno Zoo is doing what it can to keep the line moving as fans come to say goodbye to Japan’s last pandas.

Earlier this week, Tokyo’s Ueno Zoo announced that its twin giant pandas, Xiao Xiao and Lei Lei, will be leaving Japan. Fans knew this would happen someday, as the pandas, though born at Ueno Zoo, are the children of a pair of pandas on loan from China as part of a breeding research initiative, and under the agreement any babies to come out of the project would eventually have to be transferred to China.

Still, with Xiao Xiao and Lei Lei being Ueno Zoo’s biggest stars, and also the final two pandas in Japan, people are going to be sad to see them go. Anticipating large crowds wanting to come to say goodbye, Ueno Zoo has said that advance online reservations will be required to enter the panda enclosure’s viewing area starting December 23, but in the meantime anyone who wants to can line up to see the twins.

With this coming weekend the last one before the reservation requirement goes into effect, the crowds are probably going to be massive. Perhaps anticipating that, some panda fans decided to get a jump on things by heading to Ueno Zoo on Tuesday morning. After all, an a.m. visit on a non-holiday weekday should mean relatively smaller crowds, right?

Sure, but “relatively smaller” doesn’t mean “smaller,” and on Tuesday, the line to see the pandas looked like this:

After noon, the waiting time was four hours, and with Ueno Zoo closing at 5 p.m. at this time of year, at 1 o’clock an announcement was made that the staff was closing off the line for the rest of the day.

Hearing this, one might be tempted to wonder if a contributing factor could have been people staying in the viewing area for an especially long time, trying to take as many literal and mental photos as they could of the soon-to-depart panda pair. But while there were for sure a lot of pictures snapped and memories made, they had to be done quickly, because in an attempt to keep the line moving, Ueno Park is limiting the panda-viewing time to just one minute per person.

The length of the line, even with that rule in place, shows just how strong the public’s desire is to see Xiao Xiao and Lei Lei one last time, especially since once they head to China, Japan will be without any pandas at all for the first time since 1972. It’s not clear whether or not there will be a viewing time limit in place once the reservation period starts, but Ueno Zoo says that it will be limiting the total number of guests in the panda-viewing area to 4,800 people from December 23 to 26. In addition, the zoo is now saying that starting January 14 reservation eligibility will be decided not on a first-come, first-served basis, but by a lottery system, as the number of people wanting to see them will only increase as we get closer to their final day of public display, January 25.

Source: TV Asahi via Hachima Kiko, Ueno Zoo, YouTube/ANNnewsCH

Top image: PR Times

● Want to hear about SoraNews24’s latest articles as soon as they’re published? Follow us on Facebook and Twitter!",https://soranews24.com/2025/12/18/tokyo-zoo-imposes-one-minute-time-limit-for-viewing-pandas-line-still-four-hours-long/,SoraNews
2025-12-19 17:34:45,"Wed, 17 Dec 2025 16:00:54 +0000",en-US,Japanese woman mistaken for bear,"With the right clothing anyone can bear a resemblance.

Although reports of bears showing up in various parts of rural Japan are still coming in as we enter winter, it does appear that the more dangerous encounters with humans have been slowing down in recent weeks. However, the months of seemingly non-stop news about bear attacks has left a lot of people on edge.

At about 7:35 a.m. on 15 December, a motorist on National Route 13 in Yamagata City saw a bear sitting on the side of the road and reported it to the police. An alert was sent out to nearby facilities, advising everyone to be on guard for the wild animal.

▼ The approximate area where the bear was seen

About three days later, one business contacted the Yamagata Police and said that around the same time as the report, there was a woman having a cigarette and sitting with her back turned to the highway. More importantly, the woman was wearing a full-sized, black, and furry jumpsuit with bear-like ears attached to the hood.

The police investigated and confirmed the smoker’s wardrobe choice, concluding the original report was mistaken. Readers of the news online, however, weren’t so sure…

“How can we be sure bears don’t smoke?”

“I saw a monkey smoking once. Why not bears too?”

“A woman with a bear hoodie smoking on the highway is pretty suspicious too though.”

“She probably just wants attention.”

“Does she want to get shot?”

“This isn’t a good time to dress like a bear.”

“I’m a hunter, and so many times people call me about a bear when it’s really just a dog or a boar.”

“The police should set up video phones and photo sending for situations like this.”

“It’s a big problem in Yamagata, and probably better safe than sorry.”

Yamagata is one of the more affected parts of Japan when it comes to bears, and sightings are still reported daily, though as this case and one of the comments pointed out, mistakes do happen.

I think the moral of this story is that when the country is suffering from an unprecedented level of deadly bear encounters, to the point that “bear” is designated the word of the year, maybe hold off on dressing like one for a bit.

Source: TUY, Yamagata News Online, Hachima Kiko, Yahoo! Japan News

Top image: Pakutaso (Edited by SoraNews24)

● Want to hear about SoraNews24’s latest articles as soon as they’re published? Follow us on Facebook and Twitter!",https://soranews24.com/2025/12/18/japanese-woman-mistaken-for-bear/,SoraNews
2025-12-19 17:34:46,"Wed, 17 Dec 2025 14:00:03 +0000",en-US,Return of Totoro sequel short anime announced for Ghibli Park,"Yes, if there’s a Catbus, of course there’s a kitten bus too!

If you want to visit Ghibli Park, it’s important to plan ahead, and there are three reasons why. The most obvious is that the theme park, dedicated to the anime films of Studio Ghibli, requires reservations, which need to be made more than a month in advance. Second, while Ghibli Park isn’t located too far from Nagoya, it’s still a fair bit outside the city center, so you’ll need to sort out the train or bus route you’ll be taking there and back.

And then there’s the third reason: the Ghibli short anime films that screen in Ghibli Park’s Ghibli’s Grand Warehouse area’s theater. These shorts, around 15 minutes in length, are filled with the charming artistry that’s made Studio Ghibli beloved around the globe, but can only be seen at two places in the world, Ghibli Park and the Ghibli Museum in Tokyo. Out of about a dozen total films, only one is screened at a time, with a new one rotating in every month or so. They’re all worth watching, but if there’s one in particular you’re keen to see, it pays to check the schedule and try to plan your visit while it’s playing, and if you want to see the sequel to My Neighbor Totoro, you’ll want to head to Ghibli Park after the new year starts, but before winter is over.

Mei and the Baby Catbus is written and directed by Totoro creator Hayao Miyazaki himself, and features a soundtrack by longtime collaborator Joe Hisaishi. As you can tell from the preview image, it features a baby-sized version of My Neighbor Totoro’s unforgettable Catbus, and without giving too much away, Ghibi Park describes the short’s story with:

“On a very windy day, while Mei was eating caramels, she spotted a whirlwind and started chasing after it. When she finally grabbed hold of it, it turned out to be a Baby Catbus. Mei and the Catbus became friends, and that night, they ventured into the forest.”

Mei and the Baby Catbus will screen at Ghibli Park from February 1 to 28. There’s no additional fee to watch it, but under Ghibli Park’s unique admission system not all tickets get you into all sections of the park, so you’ll want to make sure to purchase one that provides access to Ghibli’s Grand Warehouse, which also debuted seven new step-into-a-Ghibli-anime-scene-style displays this week.

Tickets to Ghibli Park for February visits are on sale now through the park’s website. Oh, and if you’re headed to Nagoya from Tokyo or Osaka to watch Mei and the Baby Catbus, you can get there by the Final Fantasy Shinkansen.

Related: Ghibli Park official website

Source: Ghibli Park

Top image: Studio Ghibli

Insert image: Ghibli Park

● Want to hear about SoraNews24’s latest articles as soon as they’re published? Follow us on Facebook and Twitter!",https://soranews24.com/2025/12/17/return-of-totoro-sequel-short-anime-announced-for-ghibli-park/,SoraNews
2025-12-19 17:34:46,"Wed, 17 Dec 2025 05:00:25 +0000",en-US,"Street Fighter Hadouken Churros to be launched and eaten in Tokyo, Okami pudding on offer too","Hadouken Pasta also on the menu at themed cafes celebrating Capcom art and history exhibition.

Back in October, video game publisher Capcom caused a stir by teaming up with McDonald’s Japan for a line of Street Fighter hamburgers. It turns out that this was just the beginning of Capcom’s culinary ambitions, though, as it’s got a whole new menu of themed food about to be served up in Tokyo, including hadouken churros!

The Great Capcom Exhibition, also called Capcom Creation, is rolling into Tokyo later this month with displays chronicling the technical and artistic evolutions behind some of the industry’s most enduringly popular series. The Tokyo venue for the traveling event will be Creative Museum Tokyo, located a few blocks east of Tokyo Station, and attached to the event space is a cafe, which will concurrently have a special menu called the Great Capcom Exhibition Food Festival.

Grabbing attention right off the bat are the Hadouken Churros, served in a wrapper showing Street Fighter protagonist Ryu in his classic fireball-launching pose, with a coating of blue chocolate at the tip representing the most famous projectile in the fighting game genre.

Speaking of the hadouken, it’s also the muse for the Hadouken Tomato Pasta.

The styling cue here is the joystick-motion/button-press combination for throwing a hadouken: down, down-forward, and forward with a punch button. While listed as a “pasta” on the menu, the preview photo looks like it might actually be something closer to a risotto, with the sphere at the center of the dish looking like the ball-top of the joysticks that are standard on Japanese arcade game cabinets.

Other highlights of the menu include a hunk of Monster Hunter hamburger steak meat…

…a black pork curry recreating Mega Man’s infamous battle with the Yellow Devil boss in his very first outing on the NES/Famicom…

…a Pheonix Wright bento box with fish, egg, and vegetables covered by a sheet of nori seaweed with cutouts to write the characters 異議あり！, pronounced Igi ari and meaning “Objection!”…

…and a paella inspired by the rural-Spain setting of Resident Evil 4.

As for desserts, the cafe will be happy to whip you up a milky Okami Amaterasu purin (pudding), an Earl Grey Monster Hunter Palico purin…

…or a strawberry sundae, the favorite sweet indulgence of Devil May Cry’s Dante.

Prices for the above main dishes range from 1,890 to 2,980 yen (approximately US$12.50-US$19.50), while the puddings are 1,190 and the strawberry sundae 1,590. Like at a lot of themed cafes in Japan, diners can get character art coasters when placing orders, and in a kindhearted twist, instead of being given out randomly they’re specifically tied to the main dishes and Dante dessert (so, for example, you get the Palico coaster from ordering the Monster Hunter meat, the Ryu one from ordering the Hadouken Pasta, and so on). Spending more than 3,000 yen in total at the cafe also gets you a coaster with all of the characters together.

While tickets are required for the Great Capcom Exhibition itself, you don’t need one to dine at the cafe, and the Hadouken Churros are available to purchase as a takeout item too for 890 yen.

Both the themed cafe and exhibition are scheduled to run from December 20 to February 22.

Related: Great Capcom Exhibition official website, Creative Museum Tokyo official website

Source, images: PR Times

● Want to hear about SoraNews24’s latest articles as soon as they’re published? Follow us on Facebook and Twitter!",https://soranews24.com/2025/12/17/street-fighter-hadouken-churros-to-be-launched-and-eaten-in-tokyo-okami-pudding-on-offer-too/,SoraNews
