수집날짜,뉴스 보도 날짜,수집국가,제목,내용,링크,언론사
2025-12-19 17:34:35,"Fri, 19 Dec 2025 07:04:34 +0000",Unknown,Japan needs to possess nuclear weapons: PM office source,"A source within Japan's prime minister's office said Thursday that the country needs nuclear weapons, remarks that deviate from the country's long-standing non-nuclear principles and could trigger backlash at home and abroad.

""I think we should possess nuclear weapons,"" said the source, who is involved in devising security policy under the government led by Prime Minister Sanae Takaichi, while also indicating that such a move is unrealistic.

The remarks came as Takaichi, known for her hawkish security views, is considering reviewing Japan's non-nuclear principles, long upheld given the country's status as the only nation to have suffered atomic bombings.

During the exchanges with reporters, the source was asked about the idea of possessing nuclear arms.

Acknowledging the necessity of the destructive weapons, the source said, ""In the end, we can only rely on ourselves.""

The individual, however, also said, ""It isn't something that can be done quickly, like just going to a convenience store to buy something.""

Government sources earlier said that Takaichi, who also heads the ruling Liberal Democratic Party, is considering reviewing the Three Non-Nuclear Principles, which prohibit possessing, producing, or permitting the introduction of nuclear arms.

The Three Non-Nuclear Principles were first declared in the Diet by then Japanese Prime Minister Eisaku Sato in 1967 and became viewed as a national credo. Sato won the Nobel Peace Prize in 1974 for the declaration and his contributions to peace.

Seeking to alter its basic nuclear policy remains controversial in Japan, with many in the public cherishing the pacifist postwar Constitution. It also runs counter to the government's efforts to pursue a world without nuclear weapons, an ardent wish of aging atomic bomb survivors in Japan.

At the same time, however, Japan has relied on U.S. nuclear deterrence for protection, which some critics say already contradicts the non-nuclear principles.

The prime minister's office source denied having a discussion with Takaichi about reviewing the non-nuclear principles.

In 1999, then Parliamentary Vice Defense Minister Shingo Nishimura, a member of the now-defunct Liberal Party, was sacked after coming under fire for suggesting that Japan consider arming itself with nuclear weapons.

© KYODO",https://japantoday.com/category/politics/update1-japan-needs-to-possess-nuclear-weapons-pm-office-source,Japan Today
2025-12-19 17:34:36,"Thu, 18 Dec 2025 21:44:15 +0000",Unknown,Bank of England cuts interest rate after UK inflation slides,"The BoE's widely expected reduction followed a regular policy meeting and came ahead of the European Central Bank's rate decision Thursday

By Alexandra BACON

The Bank of England cut its key interest rate to 3.75 percent on Thursday after UK inflation eased faster than expected and as the economy weakens.

""We've passed the recent peak in inflation and it has continued to fall, so we have cut interest rates,"" BOE governor Andrew Bailey said.

The widely expected quarter-point reduction followed a regular policy meeting and came ahead of the European Central Bank's rate decision Thursday.

Expectations for the reduction were cemented by official data Wednesday showing Britain's annual inflation rate had slowed more than expected to 3.2 percent in November.

Analysts forecast the BOE to cut borrowing costs further next year with UK inflation set to move closer to the central bank's two-percent target.

Thursday's decision marks the sixth reduction since the BOE began a trimming cycle in August 2024, one month after Britain's Labour party won a general election.

In a close result, policymakers including Bailey voted 5-4 for a cut Thursday. Four members of the Monetary Policy Committee voted to hold borrowing costs at 4.0 percent.

""We still think rates are on a gradual path downward,"" Bailey said. ""But with every cut we make, how much further we go becomes a closer call.""

The central bank last cut its key interest rate in August amid concerns over the impact of U.S. tariffs on the UK economy.

A cut to interest rates eases pressure on Prime Minister Keir Starmer, who has struggled to revive Britain's sluggish economy since Labour came to power in July 2024.

""Inflation is coming down and looks to be supportive to future rate cuts,"" said Lindsay James, investment strategist at Quilter.

""With economic growth also in the doldrums, and showing no sign of improvement in 2026, there will be a huge amount of pressure on the Bank of England to help stimulate some sort of economic activity,"" she added.

Finance minister Rachel Reeves welcomed the rate cut but acknowledged in a statement that ""there's more to do to help families with the cost of living"".

Reeves raised taxes on businesses in her inaugural budget last year -- a decision widely blamed for causing weak UK economic growth and rising unemployment.

She returned in her November budget with fresh tax hikes to bring down government debt, this time hitting workers.

While a cut to the interest rate can help individuals and businesses taking out loans, it reduces returns on savings deposited in banks.

Britain's retail banks tend to mirror changes to BOE monetary policy on their accounts, including for mortgages.

Elsewhere, the ECB is set to hold interest rates steady Thursday for a fourth meeting in a row as eurozone inflation remains in check.

With the hold likely a done deal, investors will be paying close attention to ECB President Christine Lagarde's press conference for any hints on the path forward after Governing Council members gave conflicting signals.

Friday will likely see the Bank of Japan hike its key rate to a 30-year high as the country's inflation stays high and after BoJ governor Kazuo Ueda said the impact of U.S. tariffs was less than feared.

© 2025 AFP",https://japantoday.com/category/business/bank-of-england-cuts-interest-rate-after-uk-inflation-slides,Japan Today
2025-12-19 17:34:37,"Fri, 19 Dec 2025 07:04:15 +0000",Unknown,Japan eyes adding Japanese proficiency to permanent residency requirements,"Japan is considering adding Japanese language proficiency to the requirements for permanent residency, sources close to the matter said Thursday, in anticipation of a rise in future applicants.

The idea is expected to be included in proposals for new requirements to be compiled by a ruling Liberal Democratic Party panel by April 2027, when an amendment to the Immigration Control and Refugee Recognition Act comes into effect.

The revised law also allows for permanent residency to be revoked if the holder intentionally neglects public obligations, such as paying taxes.

According to the Immigration Services Agency, the number of foreign residents in Japan stood at a record 3.96 million as of the end of June, with permanent residents comprising the largest group at around 930,000, or 23.6 percent, of the total.

Currently, a foreigner applying for permanent residency must have resided in Japan for at least 10 years and provide evidence of having the means to support themselves, among other requirements.

Given an expected increase in permanent residents in the future, additional requirements such as Japanese language proficiency and mandatory participation in programs that teach community rules, as well as raising the required minimum income have been discussed.

Stricter rules for part-time work by international students are also being reviewed to prevent them from working more hours than permitted. Currently, students may work up to 28 hours per week in jobs outside their designated status if granted permission by immigration authorities.

The government is considering shifting to a screening process that evaluates academic performance and other factors when giving permission to work, rather than granting permission upon arrival in Japan.

Meanwhile, the number of cases of foreigners holding the visa status for engineers, specialists in humanities and international services, being dispatched to engage in unskilled labor -- which is not allowed under the residency status -- has prompted the government to consider enforcing more stringent monitoring by staffing agencies and other employers.

© KYODO",https://japantoday.com/category/national/japan-eyes-adding-japanese-proficiency-to-permanent-residency-requirements,Japan Today
2025-12-19 17:34:38,"Thu, 18 Dec 2025 21:41:40 +0000",Unknown,England vow to keep 'fighting and scrapping' as Ashes slip away,"cricket

Bowling coach Marcus Trescothick said England would keep ""fighting and scrapping"" as the Ashes slipped from their grip Thursday, while paying tribute to a dehydrated Ben Stokes.

Only a stirring fightback can seemingly save the tourists, who need a win in the third test against Australia in Adelaide to keep the series alive.

They trail by 158 with two wickets in hand after reaching stumps on day two at 213-8 in reply to Australia's 371

Trescothick said it was disappointing they were unable to make more of an impact on a flat track perfect for batting.

""We are behind the game again in the situation we currently stand,"" he said. ""But another 10-11 overs 'til the new ball tomorrow to try and score as many runs as we can and obviously then see what happens from there on in.

""But we're disappointed, of course. I think we're still fighting, we're still scrapping away in terms of what we're trying to do.

""I thought Australia bowled well and didn't make it easy for us, and credit to them for that,"" he added. ""But we've just got to keep digging in and keep scrapping away and see what we can do.""

He admitted the batsmen were ""frustrated"" at not being able to make more of an impact, with Stokes' unbeaten 45 the top score.

""I think you're always disappointed when you don't succeed and don't get the volume of runs that you wanted to and that's probably something we haven't done as much as what we have done in other series, so far.

""The opportunity is there for someone to still do it. Ben scrapped hard today and it's up to everybody else to put their hands up and keep doing the work.""

Stokes was at his dogged best, facing 151 balls as temperatures touched 40 Celsius.

Trescothick called it a classic Stokes knock.

""He's obviously tired and a bit dehydrated more than anything else,"" he said. ""I think he found it hard getting the volume of carbohydrate drink into him, because he was sweating so quickly.

""He was feeling a bit ill and cramping for most of that last session, but it's kind of what he does and it's almost sort of his focus is at it's best when he's in that sort of frame of mind.""

© 2025 AFP",https://japantoday.com/category/sports/england-vow-to-keep-%27fighting-and-scrapping%27-as-ashes-slip-away,Japan Today
2025-12-19 17:34:39,"Thu, 18 Dec 2025 12:02:31 +0000",Unknown,Prosecutors demand life sentence for Abe's accused killer,"Prosecutors on Thursday sought life imprisonment for the man standing trial over the ""unprecedented"" fatal shooting of former Japanese Prime Minister Shinzo Abe in 2022 that shed light on the controversial Unification Church and its links to politicians.

Tetsuya Yamagami admitted to murdering Abe during his trial at the Nara District Court, saying he held a grudge against the church because of the financial ruin his family suffered due to his mother's large donations to the religious group. The ruling will be handed down on Jan. 21.

""Killing a former prime minister in the public eye is an unprecedented crime in our country's postwar history,"" prosecutors said in their closing arguments against the 45-year-old defendant. ""There is no room for leniency,"" they added.

Yamagami is accused of fatally shooting Abe with a handmade firearm during an election stump speech by the former prime minister in the western Japan city of Nara on July 8, 2022.

While Yamagami's upbringing is undeniably unfortunate, it had no bearing on his actions, the prosecutors said, adding that he was an adult who could ""distinguish between right and wrong.""

Asked by Presiding Judge Shinichi Tanaka whether he wished to make a closing statement, Yamagami shook his head twice and said he had ""nothing.""

His defense counsel, meanwhile, said in their closing arguments that Yamagami's prison term should be ""a maximum of 20 years,"" because his motivation for the crime was directly linked to his tragic upbringing.

Arguing for a shorter sentence than sought by the prosecution, the defense team said Yamagami, who would be in his 60s after serving his term, should contribute to society as a victim of harm caused by a religious group.

In the trial under the lay judge system, Yamagami said earlier he initially targeted Unification Church leader Han Hak Ja. He said he later shifted his focus to Abe after the coronavirus pandemic made it difficult for Han to visit Japan and because Abe had sent a video message to an event hosted by a group closely associated with the church.

He said he believed Abe, who was 67 when shot, was ""at the center of the Unification Church's political involvement"" in Japan. Abe had remained an influential political figure even after his resignation in 2020.

The prosecution said there was a ""leap in logic"" in his switching of target to Abe and that his action was ""extremely short-sighted and showed a blatant disregard for human life.""

Yamagami's defense counsel said he resented the church because his mother had donated 100 million yen ($640,000) to it, forcing his family into bankruptcy, something that should be considered in mitigation of his sentence.

It was revealed during the trial that Yamagami's mother joined the religious group in 1991 after her husband died by suicide in 1984. The defendant also attempted to kill himself in 2005, and his older brother, resentful of their mother's large donations, took his own life in 2015.

Ahead of the prosecutors' closing remarks, a lawyer representing Akie Abe, Abe's widow, read out her statement on her behalf. ""The sudden death of my husband was way too shocking, and my mind went completely blank,"" she wrote.

""I felt as if I was in a dream for a considerably long time. I request that the defendant properly atone for his crimes.""

Akie Abe did not appear in court on Thursday.

As Yamagami's motivations became clear following his arrest, scrutiny of links between lawmakers of the ruling Liberal Democratic Party and the church grew, with some reportedly having received support during election campaigns.

It also led to a government probe into the Unification Church over its solicitation of financially ruinous donations from members. Following a request from the central government, the Tokyo District Court in March issued an order for the church to be dissolved, stripping it of tax benefits as a religious corporation.

A law was enacted to regulate manipulative fundraising tactics by organizations, with the suffering of children of Unification Church members, referred to as ""second-generation"" followers, also drawing public attention.

© KYODO",https://japantoday.com/category/crime/update1-prosecutors-demand-life-sentence-for-shooter-of-ex-japan-prime-minister-abe,Japan Today
2025-12-19 17:34:40,"Thu, 18 Dec 2025 21:43:33 +0000",Unknown,Tech tip: Tis the season to unplug and enjoy the holidays IRL,"By KELVIN CHAN

The Christmas holiday season is a time to step back from the busy pace of modern life and connect with our nearest and dearest instead of screens, apps and chatbots.

Here are some suggestions on how to unplug from the online world for the next few weeks as you sit down for a festive meal, exchange gifts or take time out for some self-reflection.

Your phone already has built-in features that can help you stop getting distracted.

To temporarily silence all those attention-seeking notifications, use the Focus setting on your iPhone or Android device. This mode is designed to stop interruptions when you want to concentrate. You can customize it by blocking specific apps or muting only when you're doing certain things, like sleeping or reading.

Android and iOS also have related screen time controls to manage overall device usage. Too much Instagram scrolling? Limit yourself to a daily total of 20 minutes.

There are other tricks you could try, like turning the screen gray to make it less appealing. On iPhones or Android devices, tweak the color filter or adjustment settings. On Android, activating Bedtime Mode also turns the screen gray.

If you need to be more strict with yourself, then delete any or apps you're addicted to. An effective way to stop looking at your phone is by removing those apps that you spend the most time scrolling through, even if temporarily. You can always reinstall them again if the withdrawal symptoms become too much.

When the temperature drops, it's tempting to hunker down inside and stay cozy. But don’t sit on the couch all day. Head outdoors, away from Wi-Fi signals. If it's been snowing where you are, have a snowball fight or go sledding. To keep your hands warm, don't forget to put on bulky mittens — which your phone's touch screen won't respond to.

Even if there's no snow, take a walk in the woods, a park or along some tree-lined streets. Time spent outdoors, and away from screens, can benefit your mental health and physical well-being. There's even a term for it: forest bathing.

There's an app you can use to force yourself to — literally — get back in touch with nature. Touch Grass takes its name from a viral catchphrase for when someone has lost their connection to the real world because they're consumed by what's on their screens.

It's similar to other apps designed to restrict screen time by forcing users to take a timeout from scrolling. The difference is that Touch Grass requires users to go outside and take a picture of themselves physically touching some grass.

Touch Grass has a free service level that allows you to block two apps. I found it was quite effective at stopping me from opening two of my favorite time-wasters, Reddit and Instagram, though I ended up spending more time on other apps like Facebook. To block all apps, you'll have to shell out for a subscription — $6 a month or $50 annually.

If you can’t find grass because it’s winter, there’s also the option to touch snow or sand. It’s only available for iPhones so far, but there are copycat versions for both iOS and Android, though we haven't tested them.

When was the last time you sent a Christmas card? Most digital natives find it easier to type out holiday greetings or send digital cards over chat apps, than to put pen to paper.

The consequence of all the time that we spend tapping, typing or swiping on our devices is that handwriting is becoming something of a dying art. But there are neurological and cognitive benefits of handwriting, research suggests. For example, taking notes by hand is a better way for students to learn and to remember information.

So use this time of year to write a thoughtful message to someone special, a letter to a long-lost friend, or thank you notes for presents received.

If you still don't know what you want for Christmas, why not ask for a book? It's easy to find inspiration and ideas at this time of year, when many people like to share the books they’ve read over the past 12 months, and outlets including The Associated Press compile their list of the year's best books.

Reading long-form literature or non-fiction has many benefits that can't be gained from glancing at short-form bursts of text on your device, including a deeper understanding of a topic, developing empathy, increasing your focus and concentration and more.

If you're looking for a last-minute gift, how about a time-lock vault to put your devices out of reach for, say, 15 minutes, a few hours or even weeks?

There are plenty of versions for sale online. For about $30, I bought a battery-powered gray plastic model that can hold several smartphones. The instruction leaflet says it's intended to “enhance self-discipline.”

Punch in the amount of time — up to 30 days — and a digital display will count down until it unlocks. The lid has portholes so you can thread in cables for charging while you wait.

One evening, I locked my phone up for an hour and then grabbed my laptop to do some online Christmas shopping. But my plans were foiled because I forgot that authentication requests for my credit card and Amazon went to my phone.

For another gift idea, consider putting a brick phone under the tree. Also known as a feature phone, these devices cater to those who want a back-to-basics phone without all the digital stimulation that comes with a smartphone.

Retro devices from Nokia evoke the early days of the cell phone era — no touch screens, numeric keypads and throwback video games like Snake. Most can only make voice calls and send text messages.

If that sounds too primitive, there are so-called digital minimalist phones that serve a similar market niche. Devices from Light, Punkt and Balance offer sleek, modern designs but with a stripped-down experience.
",https://japantoday.com/category/tech/one-tech-tip-tis-the-season-to-unplug-and-enjoy-the-holidays-irl,Japan Today
